<?xml version="1.0"?>

<spheres
xmlns:xsi="http://www.w3.org/2001/XMLSchema-instance"
xsi:noNamespaceSchemaLocation="InputSpheres.xsd">

	<sphere>
		<meshWidthS>1.2</meshWidthS>
		<massS>1.0</massS>
		<meanVS>0.1</meanVS>
		<parTypeS>1</parTypeS>
		<radiussph>20</radiussph>
		<epsilon>1.0</epsilon>
		<sigma>1.0</sigma>
		
		<centerPos>
			<x>150.0</x>
			<y>150.0</y>
			<z>0.0</z>
		</centerPos>
		<startVel>
			<vX>0.0</vX>
			<vY>0.0</vY>
			<vZ>0.0</vZ>
		</startVel>		
	</sphere>

</spheres> 
