<?xml version="1.0"?>

<spheres
xmlns:xsi="http://www.w3.org/2001/XMLSchema-instance"
xsi:noNamespaceSchemaLocation="InputSpheres.xsd">

	<meshWidthS>1.1225</meshWidthS>
	<massS>1.0</massS>
	<meanVS>0.1</meanVS>
	
	<sphere>
		<parTypeS>1</parTypeS>
		<radiussph>10</radiussph>
		<centerPos>
			<x>30.0</x>
			<y>150.0</y>
			<z>0.0</z>
		</centerPos>
		<startVel>
			<vX>0.0</vX>
			<vY>0.0</vY>
			<vZ>0.0</vZ>
		</startVel>		
	</sphere>

</spheres> 
